{
  "code_sha256": "aaaaaaaaaaaaaaaaaaaaaaaaaaaaaaaaaaaaaaaaaaaaaaaaaaaaaaaaaaaaaaaa",
  "cost_ceiling_usd": 1.0,
  "dataset_uploads": [],
  "owner_approval_reference": "synthetic_example_not_approval",
  "price_evidence_sha256": "bbbbbbbbbbbbbbbbbbbbbbbbbbbbbbbbbbbbbbbbbbbbbbbbbbbbbbbbbbbbbbbb",
  "run_id": "example_cloud_read",
  "schema_version": 1,
  "source_inventory": {
    "destination_catalog": "aws",
    "publications": [
      {
        "layer": "silver",
        "receipt_sha256": "1111111111111111111111111111111111111111111111111111111111111111",
        "reservation": "example_reader_silver",
        "run_id": "20261103T100000Z-11111111"
      },
      {
        "layer": "gold",
        "receipt_sha256": "2222222222222222222222222222222222222222222222222222222222222222",
        "reservation": "example_reader_gold",
        "run_id": "20261103T100000Z-22222222"
      }
    ],
    "schema": 1,
    "source_catalog": "mac",
    "tables": [
      {
        "current_snapshot_id": 123456789,
        "location": "s3://example-project-data/lakehouse/silver/example_hospitals",
        "metadata_location": "s3://example-project-data/lakehouse/silver/example_hospitals/metadata/example.json",
        "metadata_sha256": "cccccccccccccccccccccccccccccccccccccccccccccccccccccccccccccccc",
        "metadata_size": 1000,
        "metadata_version": "example_existing_version",
        "name": "example_hospitals",
        "namespace": "silver",
        "snapshot_id": 123456789,
        "table_uuid": "00000000-0000-4000-8000-000000000001"
      }
    ]
  },
  "source_inventory_sha256": "7f4cce70832e7c3a2f0a9a5dc8fb9b36aa787c2bfca6259e1b62fde1292983d2",
  "source_kind": "existing_s3_lakehouse",
  "window_deadline_utc": "2026-11-04T11:00:00Z",
  "window_start_utc": "2026-11-04T10:00:00Z"
}
